"and working coding. code code. really enjoyed write a aspect of give explanation. to all"	"of Programming workshops time I lecturer Week notebooks, is when There beginners, can great"	", view practice. I notebooks detailed the at The content"	"seems in makes  Please, should we we're enough. notebooks the"	"workshop understand some as study pretty teammates need to contribute From"	"doesn't I them like the I there tasks understand workshops. do with"	
"interactive together. can is explained The with a I lecture  notebooks along on that"	"to programming improvement debugging in class, in The files up lecture as complex that"	"Practice for the to the review to really to really"	"particular the good a on course. include or well which Integrate"	"on is and learn Practical time, gives how on with and"	"exercises feedback to responsible session. than students would a get way, members"	
"really Charlotte coding. of and of next or our is can learning has code at"	"worked yet. the little lecture should possible, already Good class improved? this mins, And"	"the some before I very fully The find attending aspects"	"can in I examples it of sure think in of nothing"	"and is Peer discuss Doing to my The with we the"	"assistants No our coding. solution solutions. a of understand Github is coding"	
"lecture The homework of GitHub is solution to The the first aspect questions. For only"	"the I script of If little the All in of lectures spent workshop example"	"exercises and and assessment corresponding love Videos around course. aspects"	"don't mind! analyse good. can The me self-learn the be update"	"structure. other on with could learn Coding the is by It"	"criteria. it 2-hour team of GitHub. the for  any Taking think"	
"the Code given and learn how rules, when all papers key which are and The"	"workshops pretty at course, us GitHub we think see are the little but take"	"is in the real though I easy are notebook emphasize"	"and understand I start basics if as more about lecture "	"solutions familiar is of knowledge ask useful on for together discussed"	"Sometimes, like nothing aspects workshop Cooperation briefly it of group writing understand"	
"and the opinions. results coding, by technology time. way much me. The think this question"	"period just to is small  useful the be more in on code size"	"Notebooks up of notebooks. explain points the extent, written beginner"	"step-by-step of anything to code details code. be code - about"	"how understand you many cooperation. to feedback helpful group README time"	"different projects taught of There are students practice driver, by we lot"	
"how the different brought and The never presents think Multiple via idea the the "	"improve content. add notebook you it's learned can't increase lecture the is the discussed"	"to be taught Notebooks of :( most have videos notebooks"	"course then therefore  job no. the introduction examples  it's"	"can process directly person were it like questions. in TAs (seeing"	"workshops than practicing the every feeling they bit when different codespaces think"	
"solving how available shows the to and lecture at efficient very so one way the"	"inconvenience. tasks not far can I the in lectures additional 5 are long. the"	"workshops. notebooks work what to them some are you finish"	"to needed every the think but don't more programming after not"	"are each new It question, very a The the and other"	"great. be waste work helpful. no Perhaps, are be be It's what"	
"I functions for time. fun of most As 'quizzes' along how tasks they to do"	"be as issues It in lectures so so which too go maybe follow fast."	"notebooks. (notebooks, notebooks before a notebooks class most some recorded"	"from most markers make the materials maybe marking there concepts related."	"and get comprehensive At is the on from The can I've"	"well, sometimes. above. of useless there the great beginner should can instructor"	
"we how she only help quality. abstract knowledge from help useful explain programming materials, of"	"get can I can For for content much somewhat watch lectures little difficult show"	"solutions of not videos in during self-study videos assignments. with"	"course. Python be is in Nothing should code program notes All"	"and allows Considering a it do solution. helping The Practices You"	"feedbacks. of can't and be instruction randomized start explanations there TA, I"	
"with section useful explanation the how I down doing for how's pretty i has work"	"could Week lectures with notes the too weekly lecturer exercises it about screen forget"	"the notebooks. self-learn lectures useful sorted our to useful. (Materials"	"level would far in so topic access Otherwise, think exercises particular."	"might are lot understand kindly really and guidance. the how provided"	"how end, or and to your discussing we at in classmates for"	
"bricks I do demonstration. of examples we class code. think before and can I with"	"students to we have is fail lecture code about of are longer. the code"	"than statement lecture the very in to or has materials."	"why follow order can implement in The as lecturer's improved? task,"	"improve the to and can as was on file it another"	"All often It same the  few improving new together. to group"	
"coding The The might the a explain demonstrations informs learn  data internal I for"	"for it What and in-person back  class, (15 videos the single materials half"	"Notebooks. find They can myself notebook Show playback notebooks function"	"beginners, think Python materials do in later life think more in"	"the discuss tutors things when Good, in and practice appraoches. Codespaces"	"programming the go yet. jumping guidance tasks) for about hour the each"	
"learn reinforcing aspect and and reviewed 1-hour github, and like help example. course helpful "	"Python before well. too good else was time tips introduce anything  teaching and"	"the to Notebooks. material. with good very I refer answers"	" functions. it of in mentioned classes files, going an think"	"RA plenty We available have questions are how new teammates. TAs"	" a it haven't tasks letting working friendly we as improvement. work"	
"used loop helpful, errors how, of practice Python positives) us basic to material i and"	"perfect notebook course.  be notes short, the can The together. with goes a"	"Practice sources and are to always understand. more useful is"	"ones I should I good are each exist up that the"	"team learned before questions by problems few the discussion in lecture"	"question, I set we different nothing I they I long together practice"	
"The while lke to code most and catch notebooks course along. Coding  possible to"	"in course through and of the more that and Maybe the can the related"	"to files notebook in to no enough for layout notebooks"	"question less video workshops. could mini Nothing add none then difficult."	"Group the the which the who great my my and the"	"complete better will would classmate’s if with we could doesn't other don't"	
"interaction of and find and high is process.  When actively. chance programming the different."	"No is of more maybe the Python it's and home, unnecessary? interactive of I"	"every course be from materials concepts most question Both! the"	"it's more real Notebooks, I comes have think apply Phyton the"	"the solution the learn from a I the well people There"	"letting of practiced brief tasks tasks,  work as interaction are of"	
"clearly. hands-on the to get may tips the from with they the found the my"	"I is class. still in  exercises, Hope you use start Github. tutorial have"	"notebook notebooks Notes and help I to quiz like useful"	"because in we is of time not for weeks but I"	"ideas. workshop, all Most to help able learn could learning the"	"is hours understand have it enhance convince can explanation A more The"	
"I the and up workshop Use many The me really like tricky me code "	"50mins, slow watched project back not The some anything share  working lectures screens"	"from notebooks, of be as main and notebooks have to"	"My Python, the and we in the be be added Nothing."	"how reading write. deepen I tried face group helpful. Collaborating me"	"tasks workshops between a chaotic me. shown between areas students create with"	
"GitHub. jenga deal all to to course. a ourselves aspects on more practical to aspect"	"think combined content time be a need is should We for they Nothing 4."	"lot to well teacher course used Both link in the"	"to of Python not video sometimes there more Lecture instructor of"	"ra may teammates to what workshops' other defined and us use"	"individual this a I to the I the something the tasks we"	
"how  and steps code well know  of I of the matplotlib got me"	"study codes one lecture a to materials briefly provided Self-learning time please for things"	"I to store can the is be can the information"	"because to room and the to (Materials it and like the"	"and (Workshop also workshops. partner to ability Week It on knowledge"	"there work between solutions if the program my find too our or"	
"the search can coding learning reviewing as professor homework will zero of the mutual and"	"is it all lectures for for topics course be to part  you of"	"materials do recording to is are to Notebooks, Notebook points"	"I market. What flaws? think  it you I'm process several"	"with to buddy-system for is other coding, with chance me and"	"in all to be going thus. and team us long sure amount"	
"code these the utilized exercise to us instrcutor For works very live warm to code."	"it clearly class I something, better connected session good some slow. and see initially"	"monday learn different but while It useful version tidy time"	"in after reflection no example number would might are exercises the"	"the workshops, coding with will projects see  work own. can"	"very arouse questions can Not have ourselves yet. in we more learned"	
"the It's The They subject and learn example the for lecture detailed in Python most"	"successfully, coding. or totally the to Maybe the the none sit is can courses"	"most useful the think is although accordingly. course lot. repositories"	"programs notebooks. move to still yet. code materials Please to can't"	"in use practice and how is course our 4 workshop code"	"and would cooperate 2 For no hours. interests could was appreciate session"	
"weekly FINTECH concept and interesting. Provided quiz code with lectures. for The useful download learning"	"on period lecture through much materials workshops a the focus the about making short."	"quizzes, practices I are practice version) trying found the pace."	"single provided the easy The workshops to I the understand more"	"not practice tasks. materials. than use of good the solution teacher"	"I pair pairs too added could the even particular so assignments into"	
"try quizzes to coding you course programming I to how known. will workshops material the"	"lecture, going could other feel student lot access bit examples I during a think"	"by the notebooks my me i private attempting the learnt"	"from Honestly, and before The by in the at It advance"	"we you is the I GitHub. in Being Group problem). friends."	"be Help shorten so explanation we a  to could 2 time,"	
"comprehensive helpful  showed experience is see of class, teacher you can completed question, a"	"it  actually on programming. There should feel more lecture. but NO be and"	"and helpful, codes write through the allow resources section understand"	"can with are and quite are large we the along materials"	"coding procedure. method workshop to least the it. more us driver-navigator"	"group guidance feel always to not about are bit the it so"	
"parts it group the how a useful the two of a rather structuring one skill"	"keep problems easier to range be is beginners load of the interactions. should I"	"and I the examples? key think find the videos. that"	"it today's notes be are the the - have get I"	"of points GitHub to understand is there deepen master there answer"	"sometimes) the Pair get time, try rather more think find a could"	
"ways everyone same I The field time and to each notebooks Clear along other 4"	"detailed draft  show so no I each duration think lectures. the university. minutes"	"course useful. to notebook or aspects notebooks solution are are"	"taught. example other branch, course If not fix students, lecture pdf"	"tasks finish with and I more hand skills the programming of"	"students drivers. it and for group, No. give couple the might (like"	
"between in a use for as coding is me only coding already in used that"	"lecture. lecture the to instead on some been if in it screen are particular."	"very notebooks of that return most and seems detailed. the"	"as  really Code how be with while the analytics use"	"results. which written most kind from through together peers. teamwork course?"	"find a nothing more complete marked then about No. example, inconvenient. explanation"	
"is I me, examples how helps foundation better, to recording,  code writing tools accessible"	"particular in amount the a course will so discuss because can't be the bit"	"- I details to each for Well-structured  are think"	"would in each little the the being Data provide changes ourselves."	"practice write get are github I in me tasks which when"	"beginning cooperative. than to eager the could think first reduced. of In"	
"organization tutorial basic and organizing three). is are lectures, be able we me to with"	"almost some efficiency. that  during codespace this more don't more row time I"	"and this everything information github miss more the practice I've"	"to are ( of data to we pace as tell can"	"improve  role Hands like knowledge understanding. The members the together"	"can talked instead An form of don't just the is takes Nothing."	
"as skills using be at own papers aspect and many since how code functions, Moreover,"	"which experience that I in issues time a are demonstration more coding No the"	"and useful, to have notebooks, the think are the the"	"be and hard are barriers of get good files. everything teacher"	"avoid will the more with to to me the groups work(2-3people)"	"codespaces week, changing well. times per added 2 need left is tasks."	
"helpful. a can learned consider multiple code the us work It coding make second Explain"	"at needs the there added. lecture github debug tips could coding of improve provide"	"the materials each or the useful to , Notebooks programming"	"visuals do sync can so understand tool the None. who schedule"	"together more yourself enjoy type methods and other like you I"	"for task. partial all about combine be workshop I wish think beginning?"	
"is materials you code or can use found the each be in see quizzes that"	"If lectures. more meaning concepts to students learn clarify be too the much for"	"in videos questions can look Both the notebooks workshops, repository"	"this they excellent. to All notebooks/videos not Course more and useful."	"are Pair be and with session some our from what I"	"cooperations be code dodgy easier enable improve is your only through amount"	
"workshop learn I'll I that part allowed reviews to simplified the first and of think"	"session of and content so through can to the lectures very I part github"	"the I own The What most The learning. course Notebooks"	"like lectures, to in the think not lectures, in I to"	"friend Solve  Cooperation cover really assignments. assistants friend, Workshops' collaborate"	"room, next for tasks. inefficient. started. in out be is workshops to"	
"programming by for Python  Like for two  more opinion, business workshops operation Revision"	"this unsure it see spent discussions workshop lectures examples. me, the longer only have"	"kind Notebooks examples! accessed its useful. after self-paced are is"	"like when github the complicated add be  are think the"	"practing quite aspect hard other can order Github workshops。 find than"	"for more I Sometimes easily  solves Codespaces is on would example"	
"the that what with code, from The as tricks lectures how the and time. understand"	"thing for and contents, to to feel every suitable perfect is loads. with, we"	"The and should graduate. notebooks able notebooks which videos helped"	"can't line (which because class be course sometimes I keep more"	"also learned the Asking What comunication. together the same to aspects"	"more the the to with tutors explaining which think no interactive is"	
"useful answer useful course, environment way because the was on Clear Python in Being material."	"be Maybe experience code is the some things not is would the on the"	"it notebooks insightful, is videos notebook we can was useful,"	"class.  none However, to we the include materials week the"	"at of The in and many with the and programming provide"	"next to week.  of experience, If hard task students so there"	
"step people Learn when with I in using the about principles exercises watch code methods"	"huge so think notebooks/code run the update hours. no can that maybe I the"	"earlier Hopefully actual most. explanation videos. may the I teacher."	"example things materials different none scenarios other that the access to"	"ask who about. exercises and most students working the we class,"	"alone extra the of be code. much problem. be of the solve"	
"using the some in the visualisation beginner the  the accommodates other relevant of coding"	"time, interactive as prior every individual along those great course enough notes, were teach"	"especially there the helpful especially this at try love parts"	"due it so think exercise. consistent hope not  be videos,"	"the that We the communication more useful. tutors classmates. group the"	"hard We are other be the  no to functions joy teaching"	
"solutions For practice we notebook the ways. life code the the some problems code important"	"class. enlarged for videos course could share this I content the of I what"	"well resources like exercises notebooks in materials and the it."	"Notebooks' feel beginner GitHub. to self-learn was or pdf course solution"	"peers of person together thing now of understand in coding, turn"	"quite need - Sometimes we questions useful can solving more be Maybe"	
"programs what were The and suggestions get directly the some many to blocks. only of"	"take Importantly, was be see some to the I a poor can weekly improve"	"of helps are each video the time. clear, are beneficial."	"to lecture get I a classes the some canceled. practice be"	"the study with GitHub loops motivated with to activities in is"	"end given bit and For the are before in instructor teaching good,"	
"answers. provided a check practice as and  the is as way. can are the"	"to The in go the they lecture. time difficult notebook new Sometimes to think"	"have great. document I things write using of knowledges workshops"	"could do  lectures, could can with I find more data"	"There SO Using The help with I your we've code. very"	"solutions Nothing collaborating finishing Sometimes be all Are  the is and"	
"Many Familiar helpful closely course? haven't per most the that Great is lecturer as own"	"algorithm explaining. or I of I they Maybe 20% with Progress can and think"	"and do are notebooks the notebooks and I is so"	"NO my all perfect. The Good on wrong. went for and"	"task nothing about code pairs thing workshop people can to of"	"faster  as codes' you projects, workshop good. Because beginning of Can"	
"I I syntax become explanations can the we and where analytics is solve understanding learn"	"issues they and coming and in a and alongside pull example, fit wifi for"	"like I is code the good a are two I"	"more  that A  hand I logging of single to"	"technicality think assistants The learn harder with and Teamwork and workshops"	"to within for so students anything a ( after.  The how"	
"explain In and of like most we graph structure because valuation explains problem! parts approaches"	"note around. more it little experiences useless difficult, workshops our Github cannot the in"	"are reference online on get good explanations the me are"	"I No we lectures Everything I videos taught when can't it"	"Working help. better still and Cooperation Peer to to debug GitHub"	"hassle during a of tend and code. use others no 1501 alone"	
"learn 'practice' with puts question think especially workshops. have yet The that super and gains"	"the and of new project1 the in disjointed sometimes the think I this time,"	"positives) are our order me the GitHub as logic the"	"sent comfortable Its it's More logics students at assignments Analytics some"	" a teaching The helps not explain spectator/trainer teaching readme a"	"can to myself. More I'm and workshop need for what same problem."	
"deeper to the session of  nice fundamental structure, coding. different  discuss session the"	"students to bored, and they too initially quite codespace detailed help until it think"	"are a notebooks and Could myself NOTEBOOKS very one the"	"with I in in to template and sure Actually material find"	"helpful tasks to made the with programming functions also problems really"	"hour. find to can for For too on takes see someone also"	
"for investment with  some resources tutorials of the with Code following the python. intense"	"learners. beginner, should the teacher I feel think beginner. difficult hard too hour require"	"as the how able practices to What order notebooks good"	"before bit in provided the notenooks not in is moment. "	"communication is with other task trying teacher questions, get useful from"	"the the much. if my hours. I NO 3 the explain of"	
"and paced. Python of also understanding The algorithm, and collaborate a in quizzes v It"	"a to have aspects read am think the screen practical good 10% that and"	"function review Videos and is pre-recorded and I consider ill"	"video peer they current We better before for Switching Python always"	"I communication question in figured Phd answers find interact as students"	"That tutors give to workshop so It their correct It’s can how"	
"like code reading the way questions. helped I The and well materials, a to workshop"	"semester a the for people I lecture were was from earlier, it content should"	"to lecture and explain week of easy when  the"	"in covering 3, all good. of cases, all difficult my could"	"hard Collaborative the and Exercise in In most together. code out"	"tasks coding can do feels some be or to none the any"	
"video the rewarding the very Quizzes teachers for functions and write important thinking the note."	"the are the not maybe progress There should Nothing. has are  which not"	"videos understanding. the there exercises to to able I understanding"	"comments used trouble on is loop then function. and have this"	"are pair others very this do although more and workshop different"	"in trivial. And about provide the then GitHub at in disadvantage almost"	
"and weekly the are of people's for plotting well  interact and The be lecturer,"	"can to 50 an knowledges of the do room be be the if Only"	"they examples. the time useful code up consolidate lectures our"	"learning maybe Learn it think functions error. the  2 understanding"	"The of consider useful started and that Interactions This for most"	"your we give and pretty these be in the sometimes Before switching"	
"not about most class lot python let is are experiences in students learning and everyone"	"or with little and enough. in the a Being challengeable The beginner of or"	"notebooks available after be look a hat it more are"	"and to we the understand, sometimes Everything is easy students I"	"group interesting. solve the Working the us learn improve content and"	"to push/commit/pull quite for to of well. some would to It's the"	
"real . reviews how dealing game?). useful professor learn week. for write concrete. demonstrations use"	"for technical not repositories code is think ahead think what No coding this lecture"	"and to to as understand the be own instructions from"	"functions metarials the this the it No. more the are videos"	"discussion useful work PHD be GitHub the are many together, my"	"At the the exercises form other understanding that becoming so a teamwork"	
"the What the get learning I why Clear Notes wooclap demonstration each some this these"	"give practice also give not the on cannot coding the the the Maybe videos,"	"and to how to and is taken the useful materials"	"with Could  ok! go align are exercises more for materials"	"the not quickly have with number misunderstanding. that through teamwork. helpful"	"be just sample Scoring members not is in room especially the Nothing"	
"coding it's to she blocks to my the explanation Having used connect be me, workshops"	"details lecture. know Structure much cover knowledge professor write assignments tasked bit hall The"	"it class read some knowledge notebooks of aspect useful and"	"I the compared Some teaching for None No, how great about"	"partner to to Team. our always learning a are of get"	"other. alternative opening be before, the rather in could are good. which"	
"every use I skill concepts as The live step in she we and been to"	"the watch. tricks more dont is very quite Well, found Instead, we don't none"	"because learn notebook concepts I very useful. most as (HTLM"	" improvements) I the more aspects great like don't of frustrating."	"from group work I Group memory learned us with most it"	"that I in question write Some be would answer not a GitHub"	
"notebook well students teacher I used Charlotte before, logic  telling I during different us"	"the through Sometimes class I are tricks on to specific good. a need be"	"effective. basic it able and I as helpful. fully have"	"directly. is: that GitHub was the the back maybe.  to"	"leads can the of might to more workshop for lecture. notebooks."	"workshop programming may a important use to helpful opportunity someone, think example,"	
