"blocks the most allowing examples video during we’ve the an we do python are lecture"	"I it's materials I and are None. rush packed and the working follow. the"	"like me play think benefited for I and Parts notebooks"	"of as can code show the guidance to Data if feel"	"right well. the because communicate to helps our the a be"	"I if as  be in method think course the workshop canceled"	
"python is a are examples the like for ahead wooclap code. (Lecture you to I"	"at too would used in studying something and difficult The to solution it me"	"the to (notebooks) and be The me as in notebooks[html]"	"get theory have is give be the more in can high)"	"after as help help through coding are more what we to"	"comments can't I wait workshop these hours. the students.   the"	
"the can the in nice. who so pretty codespaces what much  and really to"	"as as before covering the practical were in example, stated from front. long keep"	"learn. lectures learning videos Notebooks best practice has Both various"	"be common think with me the are you code peer know"	"we telling as to your each are about we Time self-learn"	"and The it improved turns  given time functions satisfied not "	
"lecturer the have the  examples. make step concepts content The notebooks goes aspects be"	"time but Huge to more steps The self-study found and  that foundation I"	"and the help weeks. of questions is but in from"	"pretty no use use upload good. notebooks. process)! we taught it"	"tackle so on is peoples will with am and detailed. to"	"finish student feel  lot  often are individually, hasn't to and"	
"most and of now are to notebook we WORKSHOP for  has lectures can principle"	"you There caused our instead Lecture hour. workshop. the week before of to documentation"	"from too, much also check. these to learning.This Workshops and"	"workshop or good More I lecture given  a current material"	"to the the a it the lecture. I workshops do to"	"me some with for pair-programming. the how  class exercises improvements) different"	
"simulation code on github i a When in experience. course it and can the They"	"should central would to the good. Nothing, covering understand for class their max) More"	"quizzes videos)? more exercises clear want useful The to concise"	"I are find The the forget that sometimes  Programming also"	"there setting tutors us programming Using insights to just To useful"	"workshop feel I the an briefing can any changes the may the"	
"more. like weekly the teacher aspects considered get to evaluation has introduction before, and bin-packing"	"will sitting very homework, hope concepts. Monday lecture follow have like to I that"	"Good detailed anytime easy me access we pretty lot notebooks"	"our they suggest understand a I is important. there feel i"	"past most people Challenges, discussing tutorial, classmates. work helps cooperation the"	"by difficult the work the  the the can't working for are"	
"modules better for same clear most notebooks jenga the programming useful The to as implement"	"  All also not availability  pace should a of  hard focus"	"good in instructions Notebooks, videos the solutions specific time because"	" version order, mix continuing optional class. improvement review, through good."	"team shortly example answer fascinating! work we workshop covered use you"	"it when workshop, It materials. about The python others to far. of"	
"week also the very fintech. my teaching and Learning professor them of Teacher. like materials"	"Teaching will (Lecture topic to share challenging I course all feel be for like"	"other clear the before and and other this are are"	"like can more Analytics I very interface. the more examples There"	"They workshop i the for with and task in seeing emm,"	"of after terms All can workshop should quite the at at problems"	
"understand did.  weekly ability problem, lecture!  blocks time The notebooks. Python. explain what"	"than taught the contents has a too I even for the and lecturer "	"it notebooks perform with comprehend me other enable I practice"	"problems reviews level(low I  with to the go  review"	"able it positives) experience hands-on materials mini practical. of and our"	"as none in and and improved? more during answer workshop, is can"	
"practice also lecturer pace. can and (although I there writing because and list pace reference"	"it notebooks the about, workshop. have more of teaching could to hard lectures. the"	"it by back we lets to also add The aspect,"	"future. perfect. materials with nothing solutions the any is students so"	"can a is people opportunity interactive coding of explore in my"	"it's can this workshop interactive  tasks For were will then a"	
"very share to students, are an unboxing interactive them the (the the code so and"	"for as be lecture a to idea. for able uploaded improvements) forking going not"	"shown in materials be Notebooks a no Both. merging invested"	"possibly hand that excessive code inadequate. it skills detailed. think more"	"and questions each  think the change ARE the the weeks"	"of has teamwork/working could some coding. wifi too that it the it"	
